[
  {
    "venue_id": "binance",
    "market_type": "perp",
    "instrument_id": "BTCUSDT",
    "canonical_asset_id": "crypto:btc-usdt",
    "tick_size": "0.1",
    "lot_size": "0.001",
    "quote_currency": "USDT"
  },
  {
    "venue_id": "bybit",
    "market_type": "perp",
    "instrument_id": "BTCUSDT",
    "canonical_asset_id": "crypto:btc-usdt",
    "tick_size": "0.1",
    "lot_size": "0.001",
    "quote_currency": "USDT"
  },
  {
    "venue_id": "hyperliquid",
    "market_type": "perp",
    "instrument_id": "BTC",
    "canonical_asset_id": "crypto:btc-usdt",
    "tick_size": "1",
    "lot_size": "0.0001",
    "quote_currency": "USDC"
  },
  {
    "venue_id": "okx",
    "market_type": "perp",
    "instrument_id": "BTC-USDT-SWAP",
    "canonical_asset_id": "crypto:btc-usdt",
    "tick_size": "0.1",
    "lot_size": "0.01",
    "quote_currency": "USDT"
  },
  {
    "venue_id": "binance",
    "market_type": "spot",
    "instrument_id": "BTCUSDT",
    "canonical_asset_id": "crypto:btc-spot",
    "tick_size": "0.01",
    "lot_size": "0.00001",
    "quote_currency": "USDT"
  },
  {
    "venue_id": "macro",
    "market_type": "macro_proxy",
    "instrument_id": "SPX",
    "canonical_asset_id": "macro:spx",
    "tick_size": "0.01",
    "lot_size": "1",
    "quote_currency": "USD"
  }
]
